### ISSUE TITLE
About the real time capturing of the traffic flow

### ISSUE THREAD

**Issue by cyanexttime** [hieulw/cicflowmeter#19]
Hi I'm sorry to bother you but in the your cicflowmeter, does the option -u -url offer realtime convertion or do I need to do set something else myself to make it realtime ?

**Comment by Cranky-Kobish** [comment]
> Hi,
> 
> First of all, nice work with the development of the tool in python. It is quite handy.
> 
> I agree with [@cyanexttime](https://github.com/cyanexttime) I think that to be able to capture in real time would be a key feature in the flow request mode.
> 
> I am executing:
> 
>  sudo /home/user/my-path/cicflowmeter/.venv/bin/cicflowmeter -i eth0 -u http://localhost:8080/predict -v
> And while I can see in the screen that the packets are being captured:
> 
> DEBUG:cicflowmeter:Packet 733: Ether / IP / TCP some-ip:42368 > another-ip:3129 FA
> DEBUG:cicflowmeter:Packet 734: Ether / IP / TCP another-ip:3129 > some-ip:42368 A
> DEBUG:cicflowmeter:Packet 735: Ether / IP / TCP another-ip:3129 > some-ip:42368 FA
> DEBUG:cicflowmeter:Packet 736: Ether / IP / TCP some-ip:42368 > another-ip:3129 A
> In my python code (which is a very simple server listening in `localhost:8080/predict` I do not receive anything until i kill the process launched with the above command ` sudo /home/user/my-path/cicflowmeter/.venv/bin/cicflowmeter -i eth0 -u http://localhost:8080/predict -v`

Hi , 

@danim55 , I am having the exact same issue! I'm running the same command, but the flows only get sent to the URL when I stop the process (Ctrl+C).

Did you find a way to make it POST the flows immediately as they happen?
